title,abstract
"Aeromagnetic data for mapping geologic contacts at Samr El-Qaa area, North Eastern Desert, Egypt","Delineating the edges of different magnetized sources represents a fundamental tool for interpreting and mapping rock boundaries of magnetic data. The present study deals with the enhancement of reduced to the pole map (RTP) of Samr El-Qaa area, North Eastern Desert, Egypt, to map deep and surface geologic contacts. The edge detection of geologic contacts is ensured by the upward continuation of reduced to the pole data at an altitude of 3 km, followed by the calculation of theta derivative and horizontal tilt angle derivative (HTAD) for RTP and upward continuation (3 km). The results obtained from the application of these techniques showed that the theta derivative delineates RTP source edges well, but the response of deeper sources is diffused. While HTAD presented well, responds to shallow and deep sources and also the edges of the sources were delineated well. HTAD showed a much sharper gradient over the edges of the magnetized sources at Samr El-Qaa area. The interpreted structural trends derived from shallow and deep Theta and HTAD maps of Samr El-Qaa territory illustrated that the most shallow dominant trends are NNE, NE, N-S, NNW, WNW, E-W and NW directions. While the deep structural ones are the ENE, NW, N-S, and E-W directions. This approach for edge detection used in this study is comprehensively applicable to other portions of the Egyptian Eastern Desert and other areas with alike geologic conditions around the world to give much sharper gradient over the edges of the magnetized sources which can be used for mineral and oil/gas exploration."
Mechanical criteria and sensitivity analysis of water inrush through a mining fault above confined aquifers,"A mechanical model of water inrush through a mining fault in the workface above confined aquifers was developed according to ground pressure and strata control theory. Based on limit equilibrium theory of rock mass, mechanical criteria of the water inrush through the mining fault in the workface above confined aquifers were deduced by considering Mohr–Coulomb yield criterion. Five influencing factors, namely fault dip, fault cohesion, fault internal friction angle, suspended goaf range behind the workface, and thickness of floor strata protective zone, were selected from the mechanical criteria of an ultimate hydraulic pressure that the stope floor strata with a fault can tolerate. An orthogonal test was performed to analyze the sensitivity of the ultimate hydraulic pressure tolerated by the stope floor strata with fault. Results show that the fault dip and thickness of the floor strata protective zone significantly influence the ultimate hydraulic pressure tolerated by the stope floor strata with fault and represent 32.8% and 32.5% of the total effects, respectively. The fault cohesion, fault internal friction angle, and suspended goaf range behind the workface exert similar effects on the ultimate hydraulic pressure that the floor strata with a fault can tolerate and comprise 10.5%, 13.5%, and 10.7% of the total effects, respectively. The ultimate hydraulic pressure that the stope floor strata with a fault can tolerate decreases with the increase in the fault dip, fault internal friction angle, and suspended goaf range behind the workface but increases with the fault cohesion and thickness of the floor strata protective zone. This property decreases with the distance between the coal wall of the workface and the fault. This study provides insights into the water inrush mechanism through the mining fault in the workface and its corresponding sensitivity, thereby aiding in establishing the safe mining of coal seam with fault above confined aquifers."
Wie stroomt er in de WIA in en wie stroomt uit?,"Kennis van factoren die samenhangen met arbeidsongeschiktheid kan helpen bij het identificeren van groepen die een hoog risico lopen om (langdurig) een WIA-uitkering te ontvangen en om effectieve interventies voor deze groepen te ontwikkelen. In deze studie wilden we de volgende onderzoeksvragen beantwoorden: (1) Wat zijn de belangrijkste diagnoses bij toekenning van een WIA-uitkering en hoe verschillen deze voor leeftijd, geslacht en opleiding? (2) Welke klanten stromen binnen vijf jaar uit de WIA?"
Absolute Proper Motions and the Kinematics of Globular Clusters,"Position data for stars in the vicinities of 119 Galactic globular clusters from the USNOB1, 2MASS, URAT1, and ALLWISE catalogs have been reduced in the system of the UCAC5 reference catalog. The published positions are used together with positions from the UCAC5 and Gaia DR1 catalogs (with a difference in their epochs of 65 years) and photometric data from the 2MASS survey to distinguish cluster members, determine their absolute proper motions with an accuracy of 1–2 milliarcseconds/year (mas/year), and calculate the mean absolute proper motions of the clusters with accuracies of about 0.4 mas/year. The derived proper motions and published distances and radial velocities for the clusters are used to establish the absence of rotation for a sample of metal-poor clusters in the Galactic halo. The mean velocity of the Sun relative to this sample is found to be (Vx(0), Vy(0), Vz(0)) = (−16 ± 16, −231 ± 19, +2± 16) km/s, and the distance of the Sun fromthe Galactic center is estimated to be R0 = 7.6 ±0.7 kpc. This paper is based on a presentation made at the conference “Modern Astrometry 2017,” dedicated to the memory of K.V. Kuimov (Sternberg Astronomical Institute,Moscow State University, October 23–25, 2017)."
Modern Astrometric and Photometric Surveys,"The main aim of this paper is to survey main trends in creating modern sources of astrometric and photometric data in astronomy. A list of existing optical, IR, and UV surveys and other surveys whose release is planned for the near future is given, together with a brief description and comparative analysis. This paper is based on a presentation made at the conference “Modern Astrometry 2017,” dedicated to the memory of K.V. Kuimov (Sternberg Astronomical Institute,Moscow State University, October 23–25, 2017)."
Statistics of Stars with Relativistic Velocities,"The scenario for the dynamical capture of a binary system in the neighborhood of a supermassive black hole used byHills in 1988 to predict the existence of hypervelocity stars (~1000 km/s) allows the existence of stars with relativistic velocities attaining (1/3−2/3)c, where c is the speed of light. The increase of the kinetic energy of these stars by more than a factor of 100 is due to the replacement of one component of the binary with a supermassive black hole. This scenario takes candidate of relativisti©velocity stars outside our Galaxy, into intergalactic space, where they could be ejected from merging galaxies populated by supermassive black holes. At present, this is a hypothetical class of stars with anomalous kinematics, but it is already posing a serious challenge for modern astrometry, which, like 300 years ago, is still concerned with the detection of proper motions. While this was related to stars in the solar neighborhood at the time of Halley, is now a problem for studies of the most remote and weakest stars in intergalactic space. Possibilities for detecting such stars must be based on estimates of their abundances, that is, on their statistics. This paper is based on a presentation made at the conference “Modern Astrometry 2017,” dedicated to the memory of K.V. Kuimov (Sternberg Astronomical Institute, Moscow State University, October 23–25, 2017)."
Morphology of Seyfert Galaxies,"We probed the relation between properties of Seyfert nuclei and morphology of their host galaxies. We selected Seyfert galaxies from the Sloan Digital Sky Survey with redshifts less than 0.2 identified by the Vé ron Catalog (13th). We used the FracDev parameter from SDSS galaxy fitting models to represent the bulge fractions of the Seyfert host galaxies. We found that the host galaxies of Seyfert 1 and Seyfert 2 are dominated by large bulge fractions, and Seyfert 2 galaxies are more likely to be located in disk galaxies whereas most of the Seyfert 1 galaxies are located in bulge-dominant galaxies. These results indicate that the types of AGNs are related to their host galaxies and cannot be explained by the traditional unification model of Seyfert galaxies."
Localized Objects Formed by Self-Trapped Gravitational Waves,"Geons are localized horizonless objects formed by gravitational waves, held together by the gravitational attraction of their own field energy. In many respects they are similar to scalar field pulson/oscillon configurations, which were found numerically in 1976 by Kudryavtsev, Bogolyubskii, and Makhankov. If there is a negative cosmological constant, the spacetime of geons asymptotically approaches the anti-de Sitter (AdS) metric. AdS geons are time-periodic regular localized vacuum solutions without any radiation loss at infinity. A higher order perturbative construction in terms of an amplitude parameter shows that there are one-parameter families of AdS geon solutions emerging from combinations of identical-frequency linear modes of the system."
Equilibrium Configurations of Rotating White Dwarfs at Finite Temperatures,"In this work, cold and hot, static and rotating white dwarf stars are investigated within the framework of classical physics, employing the Chandrasekhar equation of state. The main parameters of white dwarfs such as the central density, pressure, total mass and radius are calculated fulfilling the stability criteria for hot rotating stars. To construct rotating configurations the Hartle approach is involved. It is shown that the effects of finite temperatures become crucial in low-mass white dwarfs, whereas rotation is relevant in all mass range. The simultaneous accounting for temperature and rotation is critical in the calculation of the radii of white dwarfs. The results obtained in this work can be applied to explain a variety of observational data for white dwarfs from the Sloan Digital Sky Survey Data Releases."
On the Final Gravitational Wave Burst from Binary Black Holes Mergers,"We use perturbation theory in the strong-field regime to study the inspiral-to-plunge transition of a test particle into a Kerr black hole. We found a smooth transition, without burst, and with lower energy and angular momentum radiated in gravitational waves with respect to previous treatments in the literature. Besides their theoretical interest, our results are relevant for the waveform templates of binary black hole mergers used for gravitational waves detection which are constructed on the basis of a inspiral-to-plunge transition with a high energetic burst."
Loop Quantum Cosmology and Probability of Inflation,"We study the measure on the set of initial conditions in remote past for Loop Quantum Cosmology with massive scalar field motivated by various choices of the measure present in the literature. The main finding of the paper is existence of an attractor at contracting phase of the universe, which, in addition to the well known attractor at expanding phase, predicts a very specific duration of inflationary stage with the number of e-foldings about 140."
Dynamics of Natural Satellites of Planets Based on Observations,"There is wide interest in the results of studies of the dynamics of satellites of planets. Such data are needed to determine the physical properties of celestial bodies, and they may be able to provide information about the origins and evolution of the solar system. The general approach to studying the dynamics of satellites involves developing models for the motion and ephemerides based on observational data. Ephemerides are required to prepare and launch space missions to other planets and help discover new celestial bodies. High-precision astrometric coordinates of the principal satellites of Jupiter, Saturn, and Uranus are derived from photometric observations of occultations and eclipses of these satellites. To this end, worldwide observing campaigns have been organized. Enhancement in the precision of ephemerides can be obtained not only by increasing the accuracy of observations, but also by expanding the time interval covered by the observations. Many new, distant satellites of the major planets were discovered in the early 21st century. However, observations of these satellites are scarce and were obtained over short time intervals; as a result, some of these satellites were lost. To date, 179 natural satellites are known. This paper is based on a presentation made at the conference “Modern Astrometry 2017,” dedicated to the memory of K.V. Kuimov (Sternberg Astronomical Institute, Moscow State University, October 23–25, 2017)."
Kinematics of OB Associations and the First Data from the Gaia Satellite,"The first data release from the Gaia mission (Gaia DR1) is used to study kinematics of OB associations. The mean velocity dispersion in 18 OB associations containing at least 10 stars with proper motions from the TGAS catalog is 3.9 km/s. The contribution of binary systems to the velocity dispersions in OB associations is, on average, 1.2 km/s. Expansion of the OB associations Per OB1 and Car OB1 is observed. This paper is based on a presentation made at the conference “Modern Astrometry 2017,” dedicated to the memory of K.V. Kuimov (Sternberg Astronomical Institute, Moscow State University, October 23–25, 2017)."
Konstantin Vladislavovich Kuimov,"The conference “Modern Astrometry 2017,” which took place on Octobr 23–25, 2017 at the Sternberg Astronomical Institute of Lomonosov Moscow State University, was dedicated to the memory of the eminent astrometrist, teacher, and outstanding scientist and Doctor of Physical–Mathematical Siences Konstantin Vladslavovich Kuimov, who worked at the Sternberg Astronomical Institute during 1962–2017. This article is based on a presentation made at this conference."
On the Induced Gravitational Collapse: SPH Simulations,"The Induced Gravitational Collapse (IGC) paradigm points to a binary origin for the longduration gamma-ray burst (GRBs) associated with supernovae (SN). In this one, a carbon-oxygen core (COcore) explodes in a Type Ib/c SN in presence of a close neutron star (NS) companion. The SN triggers a hypercritical accretion into the NS and depending on the initial binary parameters, two outcomes are possible givimg place to two family of long GRBs: binary-driven hypernova (BdHNe), where the NS reaches its critical mass, and collapses to a black hole (BH), emitting a GRB; and x-ray flashes (XRFs) where the hypercritical accretion onto the NS is not sufficient to induce its gravitational collapse. We perform 3-dimensional (3D) numerical simulations of the IGC paradigm with the smoothed particle hydrodynamics (SPH) technique. We determine whether the star gravitational collapse is possible and assess if the binary holds gravitationally bound or it becomes unbound by the SN explosion."
GAMMA-400 Project,"Extraterrestrial gamma-ray astronomy is now a source of a new knowledge in the fields of astrophysics, cosmic-ray physics, and the nature of dark matter. The next absolutely necessary step in the development of extraterrestrial high-energy gamma-ray astronomy is the improvement of the physical and technical characteristics of gamma-ray telescopes, especially their angular and energy resolutions. Such a new generation telescope will be GAMMA-400, currently under development. Together with an X-ray telescope, it will perform precise and detailed observations in the energy range of ~20 MeV to ~10 000 GeV and 3–30 keV the Galactic plane, especially, toward the Galactic Center, Fermi Bubbles, Crab, Cygnus, etc. The GAMMA-400 will operate in the highly elliptic orbit continuously for a long time with the unprecedented angular (~0.01◦ at Eγ = 100 GeV) and energy (~1% at Eγ = 100 GeV) resolutions, exceeding the Fermi-LAT as well as ground-based gamma-ray telescopes by a factor of 5–10. GAMMA-400 will permit resolving gamma rays from annihilation or decay of dark matter particles, identifyingmany discrete sources (many of which are variable), clarifying the structure of extended sources, specifying the data on the diffuse emission, as well as measuring electron + positron fluxes and specifying electron + positron spectrum in the energy range from 1 GeV to 10 000 GeV."
Numerical Scheme for Treatment of Uehling–Uhlenbeck Equation for Binary and Triple Interactions in Relativistic Plasma,"We present a new efficient method to compute Uehling–Uhlenbeck collision integral for any two-particle and three-particle interactions in relativistic plasma with drastic improvement in computation time with respect to existingmethods. Reaction rates are compared, where possible, with the corresponding analytical expressions and another numerical results."
Prospects for Strongly Lensed Supernovae Behind Hubble Frontier Fields Galaxy Clusters with the James Webb Space Telescope,"Measuring time delays from strongly lensed supernovae (SNe) is emerging as a novel and independent tool for estimating the Hubble constant (H0). This is very important given the recent discord in the value of H0) from two methods that probe different distance ranges. The success of this technique will rely of our ability to discover strongly lensed SNe with measurable time delays. Here, we present the magnifications and the time delays for the multiply-imaged galaxies behind the Hubble Frontier Fields (HFF) galaxy clusters, by using recently published lensing models. Continuing on our previous work done for Abell 1689 (A1689) and Abell 370, we also show the prospects of observing strongly lensed SNe behind the HFF clusters with the upcoming James Webb Space Telescope (JWST). With four 1-hour visits in one year, the summed expectations of all six HFF clusters are ~0.5 core-collapse (CC) SNe and 0.06 Type Ia SNe (SNe Ia) in F115W band, while with F150W the expectations are higher, ~0.9 CC SNe and ~0.06 SNe Ia. These estimates match those expected by only surveying A1689, proving that the performance of A1689 as gravitational telescope is superior. In the five HFF clusters presented here, we find that F150W will be able to detect SNe Ia (SNe IIP) exploding in 93 (80) pairsmultiply-imaged galaxies with time delays of less than 5 years."
Relativistic Behavior and Equitemporal Surfaces in Ultra-Relativistic Prompt Emission Phase of Gamma-Ray Bursts,In this work we study a role of baryon load and interstellarmediumdensity to explain the nature of peaks in the ultra-relativistic prompt emission (UPE) phase of Gamma-ray Bursts (GRBs). We study the behavior of their Γ Lorenz factor fromthe moment of transparency all the way up to interstellarmedium. We finally study the characteristic of equitemporal surfaces in the UPE phase.
"Modeling and uncertainty analysis of seawater intrusion in coastal aquifers using a surrogate model: a case study in Longkou, China","Seawater intrusion is a complex problem involving groundwater with variable density. It has an important impact on the development and utilization of groundwater resources in coastal areas. In previous studies, numerical simulations of seawater intrusion were performed by assigning fixed values to model parameters, thereby not taking into account the influence of stochastic variability of hydrogeological parameters on model predictions. In this study, we developed a three-dimensional mathematical model of seawater intrusion by modeling vertical solute transport due to density changes resulting from seawater intrusion. We then applied a Monte Carlo–based method to analyze uncertainty in model simulations of seawater intrusion. Because the Monte Carlo method requires the simulation model to be repeatedly run, we used the Kriging method to build a surrogate model that significantly reduced the computational load compared to the simulation model while ensuring the desired accuracy. Then we used a local sensitivity analysis method to select the two parameters with the greatest influence on model output. We treated the two selected parameters as random variables, and results show that (1) the three-dimensional, variable-density seawater intrusion model can effectively simulate and predict the distribution of seawater intrusion in the study area; (2) the local sensitivity analysis can accurately identify the hydrogeological parameters that most influence model output; (3) the uncertainty analysis based on the surrogate model reduces computing time substantially and provides a realistic assessment of the effect of hydrogeological parameter variability on seawater intrusion numerical simulation results."
"Influence of hydro-geochemical processes on groundwater quality through geostatistical techniques in Kadava River basin, Western India","Hydrogeochemistry and groundwater quality of the Kadava River Basin have been performed by analyzing 40 groundwater samples for pre- and post-monsoon seasons of 2011 through different geostatistical techniques. Analyses showed that the concentrations of Mg2+ exceeded Ca2+ in both the seasons suggesting silicate weathering as a source of ions. Average Ca + Mg values contribute 73.53% of total cations and signify the major supply of mafic minerals. Elevated TDS and TH limit drinking potential and other beneficial uses indicate permanently hard water. The average concentrations of the anions were found within Indian PL except NO3, attributed to use of fertilizers. The spatial distribution maps show the EC, Mg, Na, Cl, and SO4 to be generally higher for both the seasons in flood plain deposits than denuded landforms and middle-level/high-level plateaus containing fractured basalt aquifers. It is confirmed that silicate weathering is the dominant process followed by carbonate weathering. Inputs of TDS, Cl, SO4, Mg, Na, and NO3 are influenced by rainfall and human activities. Groundwater sample numbers 20, 37, and 38 have been severely impacted from agricultural runoff as these samples are located along the surface water flow path. The high loading of TDS and TH is controlled by the Mg, Na, Cl, and SO4 ions. Elevated concentration of Na over Ca represents the ion exchange between Ca and Na. High contents of Mg, Na, Cl, and SO4 corroborate that the groundwater is influenced by anthropogenic sources. This study is an insight for water managers to address groundwater pollution problems."
"Impact assessment of coal mining on river water and groundwater and its interaction through hydrological, isotopic characteristics, and simulation flow modeling","Impact assessment of coal mining of Gare IV/6 Coal Block (GCB) on river water (Kelo River) and groundwater and the interaction between them were studied through hydrological studies like water-level monitoring, short and long-term river flow measurements, isotopic characteristics, and groundwater flow modeling. The hydrological study reveals that the groundwater flow is towards the Kelo River and the river is acting as effluent in nature. The flow direction is parallel to Kelo River in the downstream of the GCB. The isotopic study suggests that the Kelo River water is enriched with δ 18O/16O ratio as compared to watershed samples. Flow modeling suggests that the Kelo River, which is adjacent to the boundary of GCB, may contribute 88.38 m3/day of groundwater. The groundwater effluence forms a meager component of the total groundwater effluence estimated for the entire length of the Kelo River passing through the study area. Based on the groundwater flow model results it is suggested that the proposed mining operation in GCB will not have any impact on the Kelo River water flow. The suspected seepage from the Kelo River flooding on the GCB is unlikely as the hydraulic gradient is towards the Kelo River. It is suggested to have a buffer zone and an embankment between Kelo River and GCB to prevent flooding from river water breaching. The present study provides an overall understanding of the hydrogeological conditions in and around mining area which will help in safe mining operations so that any hazard or threat to the local community may be prevented."
