title,abstract
In vitro Pharmacological Effects of Astragalus eremophilus and Melilotus parviflora,"Traditional medicines are composed of herbal formulations and their active ingredients and constituents which play a crucial role in the treatment of various human ailments. Astragalus eremophilus and Melilotus indicus (L.) All. (syn. Melilotusparviflora Desf.) are used traditionally as antiperspirant, tonic, diuretic, laxative and narcotic agents. The current study was designed to investigate the Astragalus eremophilus and Melilotus indicus (L.) All. (syn. Melilotus parviflora Desf.) methanol extracts for their anti-oxidant, antibacterial and antifungal activities. Fine powder of A. eremophilus and M. parviflora was extracted with 70% methanol to get crude methanol extract. Extract was characterized for antioxidant, antibacterial and antifungal activities. Antioxidant activity of various concentrations (3 mg/ml, 1.5 mg/ ml, 0.75 mg/ml, and 0.38 mg/ml) of both plant extracts was analyzed using 2,2-Diphenyl-1-picrylhydrazyl (DPPH) free radical. Salmonella typhemorium, Klebsiellapneumoniae (gram-negatie)andStaphylococcus aureus, Enterococcus faecalis (gram-positive) bacterial strains were used for assessment of antibacterial activities. Antifungal activities of 7.5 mg/ml, 5.0 mg/ml, 2.5 mg/ml (A. eremophilus and M. parviflora) were conducted using Aspergillus niger, Aspergillus flavus, Aspergillus fumigatus and Candida albicons. At high concentration (3 mg/ml), all the tested fractions of A. eremophilus and M. parviflora methanol extracts showed potent antioxidant activities, ranging between 83.8 and 63.33%. Antibacterial activities revealed that A. eremophilus showed a maximum zone of inhibition (8.1 ±0.1) on Salmonella typheno-rium foliowed by Enterococcus faecalis (7.2 ± 0.1), Klebsellesa pneumonia (6.1 ± 0.6), and Staphylococcus aureus (5.1 ±0.4), and at highest concentration (7.5 mg/ml), however, maximum zone of inhibition of Melilotus parviflora was at 7.5 mg/ml foliowed by 5.0 mg/ml and 2.5 mg/ml against Klebsiella pneumonia, Staphylococcus aureus, Salmonella typhemorium and Enterococcus faecalis. Antifungal assessment of both plant extracts showed that the higher concentration (7.5 mg/ml) has significant inhibitory effect as compared to control. The results can lead to the conclusion that A. eremophilus and M. parviflora methanol extracts are indeed sources of potential therapeutic compounds against antibacterial, antifungal and free radical associated disorders."
Transcriptional Profiling of Catalase Genes in Juglone-Treated Seeds of Maize (Zea Mays L.) and Wheat (Triticum Aestivum L.),"The major aim of the present study was to investigate the influence of juglone (JU; 5-hydroxy-l,4-naph-thoquinone) treatments on the expression level of Catl, Cat2 and Cat3 genes, encoding the respective catalase isozymes in maize (Zeamays L.) and wheat (Triticum aestivum L.) seeds. In parallel, germination efficiency, catalase (CAT) activity and hydrogen peroxide (H2O2) content in juglone-exposed cereal seeds were assessed. Juglone applications significantly stimulated abundance of three target catalase transcripts as well as induced CAT activity and generation of H2O2 in both maize and wheat kernels. Furthermore, germination process of juglone-affected maize seeds was more severe suppressed than in case of wheat kernels. The role of juglone in triggering the oxidative stress as well as antioxidative responses in seeds of the studied model cereal species are discussed."
Distributional pattern of Sardinian orchids under a climate change scenario,"The Mediterranean is one of the major biodiversity hotspots of the world. It has been identified as the “core” of the speciation process for many groups of organisms. It hosts an impressive number of species, many of which are classified as endangered taxa. Climate change in such a diverse context could heavily influence community composition, reducing ecosystems resistance and resilience. This study aims at depicting the distribution of nine orchid species in the island of Sardinia (Italy), and at forecasting their future distribution in consequence of climate change. The models were produced by following an “ensemble” approach. We analysed present and future (2070) niche for the nine species, using Land Use and Soil Type, as well as 8 bioclimatic variables as predictors, selected because of their influence on the fitness of these orchids. Climate change in the next years, at Mediterranean latitudes, is predicted to results mainly in an increase of temperature and a decrease of precipitation. In 2070, the general trend for almost all modelled taxa is the widening of the suitable areas. However, not always the newly gained areas have high probability of presence. A correct interpretation of environmental changes is needed for developing effective conservation strategies."
Möbius Regular Maps of Order pq,"Möbius regular maps are surface embeddings of graphs with doubled edges such that (i) the automorphism group of the embedding acts regularly on flags and (ii) each doubled edge is a center of a Möbius band on the surface. In this paper, we classify Möbius regular maps of order pq for any two primes p and q, where p ≠ q."
On Tubular Tilting Objects in the Stable Category of Vector Bundles,The present paper focuses on the study of the stable category of vector bundles for the weighted projective lines of weight triple. We find some important triangles in this category and use them to construct tilting objects with tubular endomorphism algebras for the case of genus one via cluster tilting theory.
"Plumage polymorphism and variation in the melanocortin-1 receptor gene in the Fuscous Flycatcher, Cnemotriccus fuscatus (Wied, 1831)","We investigated the possible mechanisms behind the variation plumage color of the Fuscous Flycatcher, Cnemotriccus fuscatus, by sequencing the melanocortin-1 receptor (MC1R) gene, which has been associated with the variation in plumage coloration in birds. C. fuscatus is widely distributed in South America and includes seven subspecies, which differ in their plumage coloration. Here we tested the hypothesis that the variation in the MC1R gene explains the plumage polymorphism found in C. fuscatus. We sequenced the MC1R gene in six subspecies, representing two groups: group 1 (yellow morph), with three subspecies, C. f. duidae, C. f. fumosus, and C. f. fuscatus, and group 2 (white morph), with the remaining subspecies, C. f. bimaculatus, C. f. beniensis, and C. f. fuscatior. The only variation we found among the C. fuscatus sequences were six non-synonymous substitutions from 22 variable sites, none of which were associated systematically with either plumage morph. The result of the neutrality test indicated that the polymorphism of the MC1R gene is not suggestive of significant selection pressure. We conclude that variation in plumage coloration in C. fuscatus does not appear to be determined by the MC1R gene, and that it may be related to other loci or under the influence of environmental factors."
Demography of the Neotropical austral migrant Elaenia albiceps chilensis (Tyrannidae) on its breeding grounds: climate and food offer effects,"The White-crested Elaenia (Elaenia albiceps chilensis) is a Neotropical austral migrant that breeds in Patagonian forests and overwinter in South America tropics. We investigated White-crested Elaenia demography and the environmental conditions the specie is subjected at the northwest of Patagonia as a first attempt to elucidate its population dynamic. We studied the species abundance, individuals’ body condition, survival, productivity of young and site fidelity according to changes in rainfall patterns and food supply, during three breeding seasons (2009 to 2012). We color banded 361 adult and juvenile White-crested Elaenias. During the first studied season, precipitations were remarkably above the mean and ripe fruit supply was lower than in the other seasons, whereas the abundance of arthropods remained similar along the study. The species abundance decreased 50% across the study, while adult apparent survival rate, the number of breeding females, young productivity and site fidelity were 50% lower in the first season in comparison to the following seasons. Females presented lower body condition at arrival in the first two studied periods. Site fidelity diminished after unfavorable breeding season (i.e. low young productivity and fruit supply), especially for males, although they were more faithful than females and had a slightly higher apparent survival rate. Our results suggest that White-crested Elaenia demography is affected by changes in its main food resource supply (fleshy fruits) during the breeding season, indicating that this part of the annual cycle could be fundamental for its population dynamic."
The Historic Urban Landscape and the Metropolis,"The Historic Urban Landscape (HUL) recommendation adopted by UNESCO in 2011 provides a holistic approach based on landscape planning principles. It is in line with the International Guidelines for Urban and Territorial Planning adopted by UN-Habitat in 2015 (UN-Habitat 2015). HUL concerns the integration of culture in territorial planning processes and the historical urban centre inside their urban or city context. Large cities are becoming the dominant pattern of the human settlements worldwide. They are the main engine of economic development, attracting people for jobs, creating the highest values and are the main support for the globalisation process. The 21st century is the era of the metropolis, with a large increase of cities of more than 500,000 inhabitants. The heritage of the 21st century will be building through the metropolis. We can consider the metropolis as an artefact of the humankind. It produces large urban–rural systems supported by large infrastructures, iconic buildings and specific facilities. The upgrading of the main characteristics of the metropolis adds value in cities for the quality of life, creating new heritage at a scale greater than the existing world heritage categories. HUL could be extended as a relevant approach to be applied on the metropolitan scale."
Public Perceptions of Earthquake Risk and the Impact on Land Pricing: The Case of the Uemachi Fault Line in Japan,"In this paper, we explore how land pricing reflects public perceptions of earthquake risk using officially appraised prices of land situated along the Uemachi fault, which lies on a north–south axis in the east of Japan’s Osaka Prefecture. We reveal that land pricing along this fault has only incorporated fault-driven earthquake risk since residents and policy-makers first realized its potential following damage to the southern part of Hyogo Prefecture in a January 1995 earthquake along the Rokko—Awaji fault (an event now known as the Hanshin—Awaji earthquake). We find evidence of a discount of 20% in nonresidential land prices for every kilometre closer to the Uemachi fault line since the Hanshin—Awaji earthquake."
Macroeconomic Interdependence Between a Stagnant and a Fully Employed Country,"This paper presents a two-country two-commodity dynamic model where one country achieves full employment and the other suffers from secular stagnation of aggregate demand. Own and spillover effects of changes in preference, productivity and policy parameters are examined. Parameter changes that improve the stagnant country’s current account, such as a reduction in government purchases, a decrease in foreign aid and an improvement in productivity, raise the relative price of the home commodity. Consequently, home employment shrinks, deflation worsens and consumption decreases. The terms of trade for the full-employment country deteriorate. Thus, income and consumption decrease in both countries."
Do karst woody plants control xylem tension to avoid substantial xylem cavitation in the wet season?,Plants have been hypothesized to maintain strong control over xylem tension by closing stomata and to operate at a water potential above or near the critical potential at which cavitation commences. An alternative hypothesis holds that cavitation temporarily relieves water stress and stomatal closure is insufficient to prevent short term “run-away” cavitation.
An Improved Light Dark Box Test by Using Areal-Time Video Tracking System,"In the behavioral science field, many of the oldest tests have still most frequently been used almost in the same way for decades. The subjective influence of human observer and the large inter-observer and inter-lab differences are substantial among these tests. This necessitates the possibility of using technological innovations for behavioral science to obtain new parameters, results and insights as well. The light-dark box (LDB) test is a characteristic tooi used to assess anxiety in rodents. A. complete behavioral analysis (including both anxiety and locomotion parameters) is not possible by performing traditional LDB test protocol, as it lacks the usage of a real-time video recording of the test. In the current report, we describe an improved approach to conduct LDB test using a real-time video tracking system."
"Inhibition of the Formation of Amyloid-Like Fibrils with Spices, Especially Cloves","During the study of inhibition of amyloid fibril formation, a-chymotrypsin protein was developed in 55% ethanol at pH 7.0. We investigated the inhibitory effect of different spices on amyloid fibril formation using turbidity measurements and Congo red binding assays. We found that all spices except the black pepper and caraway seed prevented fibril formation. The highest inhibition was measured with the clove, which reduced the amount of aggregates by 90%. We studied the inhibitory effect of the cloves at different concentrations on aggregation, it was found that the inhibitory activity of clove is dependent on concentration. We have measured the total phenolic content of the spice extracts too. Based on all these findings we have come to the following conclusion: Our results indicate that spices can contain other compounds too — not only phenolic compounds — which influence the formation of amyloid fibrils, and the effectiveness of various phenolic compounds are different."
"The effect of light, soil pH and stand heterogeneity on understory species composition of dry oak forests in the North Hungarian Mountains","Dry oak forests have one of the richest understory vegetation in Europe, but the environmental drivers of this community have been scarcely revealed. In this study, we assessed whether the amount of light, soil pH or stand heterogeneity affect primarily the species composition of this community. We investigaed 332 sampling plots in 40–165 year old managed and abandoned Quercus cerris and Q. petraea dominated forests in North Hungary. Presence-absence data of herbaceous species and seedlings of woody species were recorded in 28 subplots within each sampling plot. Stand structure, canopy openness and soil pH were also measured in each plot. The relationships between stand characteristics and the species assemblage were explored by redundancy analysis, while the individual responses of species and species groups were studied by generalized linear mixed models. Multivariate methods and individual species response analyses provided similar results, the amount of light and soil pH were equally important variables (both of them explained 2.8% of species variance), while stand heterogeneity had a bit lower, albeit still significant role in determining understory species composition (1.9% of species variance explained). Seedlings of woody species preferred shaded (half-shaded) conditions, while many herbaceous species were positively related to light. The effect of the three explanatory variables was hard to separate, since they influenced each other as well. Sessile oak seedlings and herbs typical of dry forests, forest edges, grasslands and acidic soil habitats preferred light rich habitats with homogeneous stand structure and low soil pH. Mesic forest herbs and seedlings of other woody species were related to relatively high soil pH, heterogeneous stand structure and closed canopy. These two understory types were clearly separated regarding composition. This study emphasizes the importance of heterogenous light conditions and mosaic, diverse forest structure (presence of homogeneous and heterogeneous forest patches) during forest management for the maintenance of understory biodiversity."
"Myxomycete communities occurring in fragmented forest patches in two municipalities of Laguna, Philippines","In spite of the increasing number of myxomycete studies in the tropical Southeast Asia over the last decades, many forest patches are still left unexplored for the region, in particular in the Philippine archipelago. Thus, an assessment of myxomycete diversity, occurrence, and composition was carried out in forest fragments from two municipalities of the province of Laguna, Philippines. From the 12 established 5 m × 5 m plots, a total of 240 moist chamber cultures were prepared for this study and yielded 42 myxomycete species belonging to 14 genera. Rarefaction curves and several heterogeneity indices revealed higher species diversity in Los Baños than in Calauan. Moreover, the taxonomic diversity index also showed that the taxonomic diversity of myxomycete in Los Baños is more intuitively diverse than in Calauan. In terms of community analysis between the two municipalities, it showed that myxomycete communities clustered between different microhabitats. High values of coefficient of community and percentage similarity indices possibly implicates that spore dispersal in forest fragments in closer proximities may cause high number of shared species (60%). With an addition of Cribraria lepida as a new record for the country, this study now updates the myxomycete profile for Laguna, Philippines."
Bias in estimates of the classic and incidence-based Jaccard similarity indices: insights from assemblage simulation,"Similarity indices are often used for measuring b-diversity and as the starting point of multivariate analysis. In this study, I used simulation to examine the direction and amount of bias in estimates of two similarity indices, Jaccard Coefficient (J) and incidence-based J (J). I design a novel simulation to generate three sets of assemblages that vary in species richness, species-occurrence distributions, and b-diversity. I characterized assemblage differences with the ratio of [proportion of rare species in all shared species / proportion of rare species in all unshared species] (i.e., PRss/PRus) and the Pearson’s correlation in the probabilities of shared species between two assemblages (i.e., share-species correlation). I found that J was subject to strong positive or negative bias, depending on PRss/PRus. J was mainly subject to negative bias, which varied with share-species correlation. In both indices, bias varied substantially from one pair of assemblages to another and among datasets. The high variation in the bias across different comparisons of assemblages may compromise b-diversity estimation established at low sampling efforts based on the two indices or their variants."
The pygmy field mouse — what does influence food quality?,"The dominant rodent species in Central European agricultural landscapes are granivorous mouse species and herbivorous common voles. Although our knowledge of European wood mice is relatively good, there is a distinct lack of information on pygmy field mice inhabiting Central and Eastern Europe and Central Asia. In this study, we examine the food quality of pygmy field mice in relation to environmental and population factors, and compare the food quality of related mouse species and common voles living in the same study plots. The dietary quality of the pygmy field mouse is similar to that of other mouse species; however, the food quality of pygmy field mice and common voles differed substantially, with mice having lower and more variable nitrogen content. For both rodent species, factors such as body size, age and sex had no influence on diet quality. Pygmy field mouse diet was mainly dependent on season, while total abundance had greatest influence on common vole diet."
Neighbourhood crowding severely limits seed offspring recruitment in a temperate mesic old-field meadow,"Testing the full impact of neighbourhood crowding within natural vegetation requires more than just effects incurred by established plants. It must also include measurements that take into account suppressive effects on the earliest plant life stages of resident individuals — seeds, their germination (emergence of radicles and cotyledons), and very young rooted seedlings. In this study, we explored the potential for these effects in a field experiment spanning three years, using a novel design for controlling granivory and small mammal herbivory. This allowed us to assess the limitations of natural crowding on seed recruitment success for non-resident species introduced into both natural and denuded neighbourhood plots within a temperate mesic old field meadow in eastern Ontario, Canada. Our results show that crowding by standing vegetation of resident species caused an overall reduction of seed recruitment success by more than 90%. These data provide strong inference that suppression resulting directly from near neighbour effects are likely to impose routinely intense natural selection within temperate mesic old field habitats like our study site. The consequences of this selection, in terms of traits promoting plant fitness under competition, are traditionally interpreted in terms of superior resource depletion/uptake, typically associated with greater growth accumulation and larger potential body size. We suggest, however, that these consequences are rare. Individuals of any species approach maximum potential body size only when near neighbour effects are relatively weak — not within crowded neighbourhoods. Recent studies suggest that severe neighbourhood crowding (where virtually all resident plants are forced to remain relatively small) selects instead for ‘reproductive economy’ — i.e., capacity to produce at least a few (or even at least one) offspring despite severe body size suppression, involving a relatively small minimum reproductive threshold size. Potential for additional component traits of reproductive economy are also suggested for investigation in future research."
Status of the Ibera Seedeater Sporophila iberaensis,"Paraguayan records of the recently described Ibera Seedeater Sporophila iberaensis are compiled and reviewed. Observations of birds identifiable to this species in Paraguay date from at least 1998, with the first photographic documentation in December 2004. The species has now been recorded at a minimum of 11 localities in the departments of Cordillera, Itapúa, Misiones, San Pedro and Presidente Hayes. The first two records of the species from Brazil (both from Mato Grosso do Sul) are also listed. Most Paraguayan records are of singing males, and breeding has been documented (a pair feeding fledglings) at one locality in Cordillera department, significantly expanding the known breeding range of the species. At least three localities appear to hold small populations (observations of multiple territorial males and/or pairs). In Paraguay, as in Argentina, the species appears to prefer wet tall grasslands bordering wetland areas. Its preference for tall grasslands makes the species particularly susceptible to habitat loss and degradation through overgrazing, frequent burning, and conversion to agriculture. These threats are all present at the principal localities for the species in the country. A reassessment of the species global conservation status taking into consideration the Paraguayan range and population suggests that it may best be treated as “Vulnerable”."
Aspirin Ameliorates Preeclampsia Induced by a Peroxisome Proliferator-Activated Receptor Antagonist,"Reduced expression of peroxisome proliferator-activated receptor γ (PPARγ) in the placenta was found in women with severe preeclampsia. Aspirin is currently used as the only recommended intervention in pregnancies for prevention of preeclampsia. In this study, we aimed to investigate whether aspirin could attenuate PPARγ inhibitor (T0070907)-induced preeclampsia and its impact on expression of PPARγ. Sixty Sprague-Dawley rats were used and treated with different doses of aspirin (0, 1, and 1.5 mg/kg) in presence or absence of PPARγ antagonist, T0070907. We found that mean arterial blood pressure was significantly reduced by aspirin treatment in T0070907-exposed rats. T0070907 exposure also led to significant decrease in fetal weight and increase in placental weights. However, 1.5 mg/kg of aspirin reversed these effects of T0070907. Additionally, aspirin also reversed T0070907-induced changes in the levels of thromboxane B2, vascular endothelial growth factor, soluble fms-like tyrosine kinase, and matrix metalloproteinase 2 in both maternal blood and placental tissue. The increased messenger RNA and protein levels of Cox1 and Cox2 induced by T0070907 were markedly reduced by aspirin treatment. Importantly, T0070907 repressed both transcriptional and translational levels of PPARγ, which were reversed by aspirin. In conclusion, this study suggests that aspirin prevented the occur-rence of preeclampsia, which is possibly through enhancing both transcriptional and translational levels of PPARγ."
