title,abstract
Entanglement measures of a new type pseudo-pure state in accelerated frames,"In this work we analyze the characteristics of quantum entanglement of the Dirac field in noninertial reference frames in the context of a new type pseudo-pure state, which is composed of the Bell states. This will help us to understand the relationship between the relativity and quantum information theory. Some states will be changed from entangled states into separable ones around the critical value F = 1/4, but there is no such a critical value for the variable y related to acceleration a. We find that the negativity \({N_{A{B_I}}}\left( {\rho _{A{B_I}}^{{T_A}}} \right)\) increases with F but decreases with the variable y, while the variation of the negativity \({N_{{B_I}{B_{II}}}}\left( {\rho _{{B_I}{B_{II}}}^{{T_{{B_I}}}}} \right)\) is opposite to that of the negativity \({N_{A{B_I}}}\left( {\rho _{A{B_I}}^{{T_A}}} \right)\). We also study the von Neumann entropies S(ρABI) and S(ρBIBII). We find that the S(ρABI) increases with variable y but S(ρBIBII ) is independent of it. However, both S(ρABI) and S(ρBIBII ) first decreases with F and then increases with it. The concurrences C(ρABI) and C(ρBIBII) are also discussed. We find that the former decreases with y while the latter increases with y but both of them first increase with F and then decrease with it."
Bank Switching and Interest Rates: Examining Annual Transfers Between Savings Accounts,"We study the savings transfers between banks by retail depositors. Our sample comprises annual savings account data from the Netherlands for the period from 2004 to 2014. We control for demographic factors and find that the differences in interest rates across savings accounts help explain the extent to which depositors reallocate their savings to either a newly opened or an existing account. The depositors in our sample transfer between 3 and 6% of their savings for each percentage point difference in the interest rates. This effect is robust across various selected samples and model specifications. In addition, we show that depositors transfer a higher proportion of their deposits during the 2008–2009 financial crisis than during non-crisis years. During that crisis, the difference in interest rates remained a highly important determinant of transfer behavior."
Mapping global forest biomass and its changes over the first decade of the 21st century,"Forests played an important role in carbon sequestration during the past two decades. Using a model tree ensemble method (MTE) to regress the seven reflectance bands of EOS-Terra-MODIS satellite data against country level forest biomass carbon density (BCD) of 2001–2005 provided by United Nations’s Forest Resource Assessment (FRA), we developed a global map of forest BCD at 1 km×1 km resolution for both 2001–2005 and 2006–2010. For 2006–2010, the total global forest biomass carbon stock is estimated as 279.6±7.1 Pg C, and the tropical forest biomass carbon stock is estimated as 174.4±5.4 Pg C. During the first decade of the 21st century, we estimated an increase of global forest biomass of 0.28±0.75 Pg C yr−1. Tropical forest biomass carbon stock slightly decreased (−0.31±0.60 Pg C yr−1); by contrast, temperate and boreal forest biomass increased (0.58±0.28 Pg C yr−1) during the same period. Our estimation of the global forest biomass carbon stock and its changes is subject to uncertainties due to lack of extensive ground measurements in the tropics, spatial heterogeneity in large countries, and different definitions of forest. The continuously monitoring of forest biomass carbon stock with MODIS satellite data will provide useful information for detecting forest changes."
Hydroxyzine-induced Vertical Nystagmus,
Junctional Epidermolysis Bullosa in a Neonate,
Safety and Immunogenicity of Two Doses of a Quadrivalent Meningococcal Polysaccharide Diphtheria Toxoid Conjugate Vaccine in Indian and Russian Children Aged 9 to 17 Months,"Evaluation of tolerability, safety and immunogenicity of a two-dose series of a quadrivalent meningococcal polysaccharide diptheria toxoid conjugate (ACYW-D) vaccine in Indian and Russian infants/toddlers."
Standing up for Science,
Congenital Heart Disease in India: A Status Report,"Considering a birth prevalence of congenital heart disease as 9/1000, the estimated number of children born with congenital heart disease in India is more than 200,000 per year. Of these, about one-fifth are likely to have serious defect, requiring an intervention in the first year of life. Currently advanced cardiac care is available to only a minority of such children. A number of cardiac centers have been developed over the last 10 years. However, most are in the private sector, and are not geographically well-distributed. Challenges to pediatric cardiac care include financial constraints, health-seeking behavior of community, and lack of awareness. Government of India is taking a number of steps for improving health of children through its various program and schemes that are likely to benefit children with congenital heart disease, especially those who are vulnerable and marginalized."
Endoscopic Management of Vesicoureteral Reflux and Long-term Follow-up,To report our experience with endoscopic management of vesicoureteral reflux (VUR) by injection of a tissue bulking substance–Dextranomer/ hyaluronic acid copolymer at vesicoureteric junction.
A Single Center Experience of Pediatric Tracheostomy,"The feasibility and safety of pediatric tracheostomy care at home by parents is challenging. Many physicians are not confident of sending tracheostomized children home. We describe our experience with 12 children who underwent tracheostomy and were sent home. Nine children were successfully decannulated. With proper training of parents, the outcome of home tracheostomy seems good."
Congenital Heart Disease in India: A Status Report,"Considering a birth prevalence of congenital heart disease as 9/1000, the estimated number of children born with congenital heart disease in India is more than 200,000 per year. Of these, about one-fifth are likely to have serious defect, requiring an intervention in the first year of life. Currently advanced cardiac care is available to only a minority of such children. A number of cardiac centers have been developed over the last 10 years. However, most are in the private sector, and are not geographically well-distributed. Challenges to pediatric cardiac care include financial constraints, health-seeking behavior of community, and lack of awareness. Government of India is taking a number of steps for improving health of children through its various program and schemes that are likely to benefit children with congenital heart disease, especially those who are vulnerable and marginalized."
Endoscopic Management of Vesicoureteral Reflux and Long-term Follow-up,To report our experience with endoscopic management of vesicoureteral reflux (VUR) by injection of a tissue bulking substance–Dextranomer/ hyaluronic acid copolymer at vesicoureteric junction.
A Single Center Experience of Pediatric Tracheostomy,"The feasibility and safety of pediatric tracheostomy care at home by parents is challenging. Many physicians are not confident of sending tracheostomized children home. We describe our experience with 12 children who underwent tracheostomy and were sent home. Nine children were successfully decannulated. With proper training of parents, the outcome of home tracheostomy seems good."
Hydroxyzine-induced Vertical Nystagmus,
Junctional Epidermolysis Bullosa in a Neonate,
Safety and Immunogenicity of Two Doses of a Quadrivalent Meningococcal Polysaccharide Diphtheria Toxoid Conjugate Vaccine in Indian and Russian Children Aged 9 to 17 Months,"Evaluation of tolerability, safety and immunogenicity of a two-dose series of a quadrivalent meningococcal polysaccharide diptheria toxoid conjugate (ACYW-D) vaccine in Indian and Russian infants/toddlers."
Standing up for Science,
Turbulent rectangular compound open channel flow study using multi-zonal approach,"In this paper, an improved Shiono–Knight model (SKM) has been proposed to calculate the rectangular compound open channel flows by considering a multi-zonal (MZ) approach in modelling turbulence and secondary flows across lateral flow direction. This is an effort to represent natural flows with compound shape more closely. The proposed model improves the estimation of secondary flow by original SKM model to increase the accuracy of depth-averaged velocity profile solution formed within the transitional region between different sections (i.e. between main-channel and floodplain) of compound channel. This proposed MZ model works by sectioning intermediate zones between floodplain and main-channel for running computation in order to improve the modelling accuracy. The modelling results have been validated using the experimental data by national UK Flood Channel Facility. It has been proven to work reasonably well to model secondary flows within the investigated compound channel flow cases and hence produce better representation to their flow lateral velocity profile."
"Non-Impact Origin of the Baisha Structure in Hainan Province, China","The Baisha Structure, with a rim-to-rim diameter of ~3.7 km, in the center of the Hainan Province, southern China has been considered to be an impact crater. Field investigation and petrological study are presented in this paper to investigate the impact hypothesis for this structure. The ~600-m-thick Lower Cretaceous feldspathic quartz sandstones from the Lumuwan Formation are the major outcrops both within and outside of the structure. The amphitheater-shaped rim of the structure is composed of granite porphyries that are intruded in the Lumuwan Formation. Previously interpreted impact breccia and impact melt rocks are actually granite porphyries different cooling rates and weathering status. Rocks from locations that most likely have recorded shock metamorphic signatures are sampled, but petrographic analyses reveal no indications of shock metamorphism. While subtle structural deformation occurs at the contact boundary between the granite porphyries and the feldspathic quartz sandstones, the feldspathic quartz sandstones exhibit uniformed dipping strata across the crater floor and walls. All the evidence suggests that the Baisha Structure was not formed by impact cratering. It most likely has been shaped by a combination of magmatic intrusion and long-term differential erosion."
"An Upper Crustal Ophiolite Remnant within the Feather River Ultramafic Belt, California: Tectonomagmatic Origins and Implications for Its Evolution","The 150-km-long Feather River ultramafic belt (FRB) of the northern Sierra Nevada, California, consists of serpentinized ultramafic rocks, gabbroic rocks, with lesser amounts of amphibolitic rocks. The gabbroic rocks contain metagabbro and dikes within it. Based on the electron microprobe analyses, the metagabbro consists of typical igneous composition for clinopyroxene and early hornblende, indicating that they bear low grade metamorphism. The gabbroic rocks show Nb and Ta depletion in primitive-mantle normalized plots that is similar to typical island arc rocks. We present that the metagabbro within the ultramafic rocks is forming in the suprasubduction zone setting. Tectonic models are presented for the metagabbro and amphibolitic rocks in FRB. The low P burial metamorphism of the upper plate metagabbro and the high grade amphibolitic rocks are typical of relationships of upper plate ophiolites to metamorphic soles. The amphibolitic rocks record as metamorphic sole forming during subduction initiation beneath the ultramafic rocks and metagabbro. The unusual and protracted tectonic history of the FRB is similar to other ophiolite belts of the Cordillera of California but differs in the lack of crustal rocks."
"Geochemistry of upper Permian siliceous rocks from the Lower Yangtze region, southeastern China: implications for the origin of chert and Permian ocean chemistry","The Permian Chert Event is of great significance to understanding the geological evolution of the entire Permian; however, the origin of widespread chert formation is debated. We report new geochemical data from deep-marine siliceous rocks of the upper Permian Da-long Formation, Lower Yangtze region, southeastern China. Their geochemical results show that these thin-bedded siliceous rocks have a clear biologic origin, with rare to no evidence of hydrothermal influence. The values of Al/(Al + Fe + Mn) and Eu/Eu* are 0.60–0.84 (mean = 0.72) and 0.45–1.08 (mean = 0.77), respectively, and Mn/Ti ratios are relatively low (mean = 0.72). The correlations of LaN/CeN, LaN/YbN, and Fe2O3/TiO2 with Al2O3/(Al2O3 + Fe2O3), along with the Ce anomaly, indicate that the Da-long siliceous rocks were deposited at a transitional zone between a continental margin and the open ocean; i.e., relatively close to terrestrial sediment input and far from hydrothermal activity. The accumulation of chert is related to its unique paleogeographic location in an equatorial setting with many submarine paleo-highlands. Intense upwelling and frequent local volcanism are the main factors that promoted the development of siliceous rocks in the studied area. Ocean acidification triggered by large-scale volcanism (Large Igneous Province) during the late Permian led to extensive silica precipitation and preservation."
"Detrital-zircon geochronology and Hf isotope of Paleozoic sedimentary rocks in the Jilin Province, NE China: tectonic significance for microcontinental blocks of eastern Central Asian Orogenic Belt","We undertook U-Pb-Hf isotope testing of detrital zircons from Late Paleozoic sedimentary rocks in the Jilin Province, NE China, with the aim of constraining the tectonic evolution of eastern Central Asian Orogenic Belt. The age populations of the detrital zircons from the sandstone of the Jiefangcun Formation in the Songliao Block are ~2234, ~1782, ~1030–921, ~817, ~540, and ~381–254 Ma, whereas those of the zircons from the greywacke of the Permian Kedao Formation in the Songliao Block yield are ~2436, ~1905, ~1692, 1146–1170, ~554–498, and ~342–255 Ma. Combined Hf isotope characteristics, these ages reveal that: (1) rocks from the Jiefangcun and Kedao formations were deposited after 254 and 255 Ma, respectively; (2) these formations were sourced mainly from the Songliao Block and the Jiamus Terrane in the eastern CAOB and to a lesser amount, from the northern margin of the NCC; and (3) it appears that several remnants of ancient Precambrian basement occur adjacent to these Late Paleozoic strata that occur within the microcontinental blocks. Detrital zircons from the silty sandstone of the Miaoling Formation in the western margin of the Khanka Terrane yield peak age populations of 508–476, 463–396, and 348–258 Ma, having similar εHf(t) values to those obtained from zircons within the Jiamusi Terrane. These data indicate that (1) deposition of the Miaoling Formation in the western margin of the Khanka Terrane had started by 258 Ma, and (2) these sediments were sourced mainly from the Jiamusi Terrane and local magmatic rocks. The widespread occurrence of detrital zircons with ages of 480–550 Ma and positive εHf(t) values within the Late Paleozoic strata in the Songliao Block and the Jiamusi–Khanka Terrane, indicates that the amalgamation of these blocks took place during the middle stage of the Paleozoic, probably after the Silurian, prior to the Late Permian."
"Mediterraneibacter butyricigenes sp. nov., a butyrate-producing bacterium isolated from human faeces","A Gram-stain-positive, obligately anaerobic, non-motile, nonspore-forming, and rod-shaped bacterial strain, designated KGMB01110T, was isolated from a faecal sample of a healthy male in South Korea. Phylogenetic analysis based on 16S rRNA gene showed that strain KGMB01110T belonged to Clostridium cluster XIVa and was most closely related to Mediterraneibacter glycyrrhizinilyticus KCTC 5760T (95.9% 16S rRNA gene sequence similarity). The DNA G + C content of strain KGMB01110T based on its whole genome sequence was 44.1 mol%. The major cellular fatty acids (> 10%) of the isolate were C14:0 and C16:0. The strain KGMB01110T was positive for arginine dihydrolase, β-galactosidase-6-phosphatase, and alkaline phosphatase. The strain KGMB01110T also produced acid from D-glucose and D-rhamnose, and hydrolyzed gelatin and aesculin. Furthermore, HPLC analysis and UV-tests of culture supernatant revealed that the strain KGMB01110T produced butyrate as the major end product of glucose fermentation. Based on the phylogenetic and phenotypic characteristics, strain KGMB01110T represent a novel species of the genus Mediterraneibacter in the family Lachnospiraceae. The type strain is KGMB01110T (= KCTC 15684T = CCUG 72830T)."
Bring your own hand: how a single sensor is bringing multiple biometrics together,"In spite of innumerable benefits of multi-biometry authentication, a couple of imaging sensors are required to capture multi-biometric samples, but that increase the overall cost as well as degree of user cooperation. This work presents a single sensor-based multimodal biometric identification system by fusing major finger knuckle, minor finger knuckle, palm print and handprint features of the human hand for enhancing the security and privacy of any consumer device. A virtual imaging device has been suggested to capture palmer and dorsal view of hand with single-shot multi-trait acquisition mechanism. The hand images captured from digital camera are first preprocessed to get the major knuckle, minor knuckle and palm ROI’s. The finger knuckles and palm print ROI’s are then enhanced and transformed to illumination invariant representation using robust encoding techniques, over which ray tracing features are emphasized predominantly. A non-rigid multi-scale approach, namely deep matching, has been employed to obtain the matching score between the corresponding correlation maps for finger knuckle or palm print recognition. Apart from that, we present a new scheme to extract shape, and geometrical features of handprint and employ metric learning-based L2-norm for feature matching in \(2D^{2}{} \textit{PCA}+2D^{2}{} \textit{LDA}\) space. Five publicly available databases are used to evaluate the effectiveness of proposed approach. Finally, the score-level weighted sum rule fusion has been adopted to combine matching scores of four traits which show that the proposed method outperforms other unimodal and state-of-the-art multimodal identification methods in terms of EER (0.01%), DI (3.64) and CRR (100%)."
Bank Switching and Interest Rates: Examining Annual Transfers Between Savings Accounts,"We study the savings transfers between banks by retail depositors. Our sample comprises annual savings account data from the Netherlands for the period from 2004 to 2014. We control for demographic factors and find that the differences in interest rates across savings accounts help explain the extent to which depositors reallocate their savings to either a newly opened or an existing account. The depositors in our sample transfer between 3 and 6% of their savings for each percentage point difference in the interest rates. This effect is robust across various selected samples and model specifications. In addition, we show that depositors transfer a higher proportion of their deposits during the 2008–2009 financial crisis than during non-crisis years. During that crisis, the difference in interest rates remained a highly important determinant of transfer behavior."
Entanglement measures of a new type pseudo-pure state in accelerated frames,"In this work we analyze the characteristics of quantum entanglement of the Dirac field in noninertial reference frames in the context of a new type pseudo-pure state, which is composed of the Bell states. This will help us to understand the relationship between the relativity and quantum information theory. Some states will be changed from entangled states into separable ones around the critical value F = 1/4, but there is no such a critical value for the variable y related to acceleration a. We find that the negativity \({N_{A{B_I}}}\left( {\rho _{A{B_I}}^{{T_A}}} \right)\) increases with F but decreases with the variable y, while the variation of the negativity \({N_{{B_I}{B_{II}}}}\left( {\rho _{{B_I}{B_{II}}}^{{T_{{B_I}}}}} \right)\) is opposite to that of the negativity \({N_{A{B_I}}}\left( {\rho _{A{B_I}}^{{T_A}}} \right)\). We also study the von Neumann entropies S(ρABI) and S(ρBIBII). We find that the S(ρABI) increases with variable y but S(ρBIBII ) is independent of it. However, both S(ρABI) and S(ρBIBII ) first decreases with F and then increases with it. The concurrences C(ρABI) and C(ρBIBII) are also discussed. We find that the former decreases with y while the latter increases with y but both of them first increase with F and then decrease with it."
Effect of biological activated carbon filter depth and backwashing process on transformation of biofilm community,"The biological activated carbon (BAC) is a popular advanced water treatment to the provision of safe water supply. A bench–scale device was designed to gain a better insight into microbial diversity and community structure of BAC biofilm by using high–throughput sequencing method. Both samples of BAC biofilm (the first, third and fifth month) and water (inlet water and outlet water of carbon filter, outlet water of backwashing) were analyzed to evaluate the impact of carbon filter depth, running time and backwash process. The results showed that the microbial diversity of biofilm decreased generally with the increase of carbon filter depth and biofilm reached a steady–state at the top layer of BAC after three months’ running. Proteobacteria (71.02%–95.61%) was found to be dominant bacteria both in biofilms and water samples. As one of opportunistic pathogen, the Pseudomonas aeruginosa in the outlet water of device (1.20%) was about eight times higher than that in the inlet water of device (0.16%) at the genus level after five–month operation. To maintain the safety of drinking water, the backwash used in this test could significantly remove Sphingobacteria (from 8.69% to 5.09%, p<0.05) of carbon biofilm. After backwashing, the operational taxonomic units (OTUs) number and the Shannon index decreased significantly (p<0.05) at the bottom of carbon column and we found the Proteobacteria increased by about 10% in all biofilm samples from different filter depth. This study reveals the transformation of BAC biofilm with the impact of running time and backwashing."
Evidence on the effectiveness of health literacy interventions in the EU: a systematic review,"In the last decade, the attention for health literacy has increased in the European Union. This is due to three main reasons. First, reviews have shown that inadequate health literacy is associated with worse health outcomes, higher health care use and expenditure. Second, in all European countries the population is aging and the number of chronically ill people is rising. Improving health literacy in this group can offer greater opportunities to take an active part in society, be independent and improve quality of life. Third, since most research on health literacy has been conducted outside Europe and relatively little is known about the development of health literacy interventions and its effects on outcome measures in European countries. The aim of this systematic review was to assess the evidence on the effectiveness of health literacy interventions in the European Union published between 1995 and 2018."
Investigating the mechanism by which SMAD3 induces PAX6 transcription to promote the development of non-small cell lung cancer,This study investigated the function of SMAD3 (SMAD family member 3) in regulating PAX6 (paired box 6) in non-small cell lung cancer.
"Small-scale field evaluation of the efficacy and residual effect of Fludora® Fusion (mixture of clothianidin and deltamethrin) against susceptible and resistant Anopheles gambiae populations from Benin, West Africa","In recognition of the threat of insecticide resistance in vectors of malaria, the WHO Global Malaria Programme recommends the development of an appropriate and comprehensive response to insecticide resistance. In principle, good resistance management practice requires the application of multiple insecticides of different modes of action, for example, in rotations and mixtures. Insecticides recommended by the World Health Organization for indoor residual spraying and long-lasting insecticide nets are limited. It is, therefore, judicious to prevent the rapid spread of insecticide resistance by evaluating new insecticides formulations with different modes of action and long residual effect."
